{
  "eval_id": "eval_open_source_readiness_review",
  "case_type": "review",
  "fixture": "evals/fixtures/open-source-readiness-review.md",
  "expected_contracts": [
    "findings_first",
    "release_gate",
    "privacy_boundary",
    "residual_risk"
  ],
  "actual_contracts": [
    "findings_first",
    "release_gate",
    "privacy_boundary",
    "residual_risk"
  ],
  "passed": true,
  "failures": [],
  "residual_risk": ["Review fixture is a structure check, not maintainer approval."]
}
